{
  "record_id": "bts_001",
  "track": "ASR",
  "source_id": "local_replay",
  "ts_start": "2026-10-20T12:00:00",
  "ts_end": "2026-10-20T12:00:20",
  "text": "BTS is a South Korean music group known for songs like Dynamite, Butter, and Spring Day. The group has seven members and has gained international recognition.",
  "ingest_ts": "2026-10-20T12:00:23"
}